{
 "$schema": "https://json-schema.org/draft/2020-12/schema",
 "title": "OpenFRP74 alignment",
 "type": "object",
 "additionalProperties": false,
 "required": [
  "id",
  "name",
  "system",
  "members",
  "description",
  "source"
 ],
 "properties": {
  "id": {
   "type": "string"
  },
  "name": {
   "type": "string"
  },
  "system": {
   "const": "openfrp74"
  },
  "members": {
   "type": "array",
   "items": {
    "type": "string"
   }
  },
  "description": {
   "type": "string"
  },
  "notes": {
   "type": "array",
   "items": {
    "type": "string"
   }
  },
  "interpretation_records": {
   "type": "array",
   "items": {
    "type": "string"
   }
  },
  "source": {
   "type": "object"
  },
  "extraction": {
   "type": "object"
  }
 }
}